{"schema_version":1,"id":"archaeology.windows-media-center.media-center-grid","display_name":"Media Center Grid","kind":"archaeology","status":"proposed","maturity":"lab","priority":"P1","package":"WinUI3.Senior.Archaeology","namespace":"WinUI3.Senior.Archaeology","gallery_route":"/archaeology/windows-media-center/media-center-grid","source_language":"zh-CN","owned_paths":["catalog/Archaeology/WindowsMediaCenter/MediaCenterGrid"],"depends_on":["media.media-center-grid"],"provides":[],"archaeology_refs":[],"historical_label":"Windows Media Center Grid","public_api_name":"MediaCenterGrid","license_review":"pending"}
