{"schema_version":1,"id":"archaeology.windows11.pinned-grid","display_name":"Start Menu Pinned Grid","kind":"archaeology","status":"proposed","maturity":"lab","priority":"P2","package":"WinUI3.Senior.Archaeology","namespace":"WinUI3.Senior.Archaeology.Windows11","gallery_route":"/archaeology/windows-11/pinned-grid","source_language":"zh-CN","owned_paths":["catalog/Archaeology/Windows11/PinnedGrid/**"],"depends_on":["controls.adaptive-grid"],"provides":["exhibit.windows11.pinned-grid"],"archaeology_refs":["controls.adaptive-grid"],"historical_label":"Windows 11 Start pinned grid","public_api_name":"AdaptiveGrid","license_review":"pending"}
