{"schema_version":1,"id":"archaeology.windows-phone-metro.pivot","display_name":"Pivot","kind":"archaeology","status":"proposed","maturity":"lab","priority":"P1","package":"WinUI3.Senior.Archaeology","namespace":"WinUI3.Senior.Archaeology","gallery_route":"/archaeology/windows-phone-metro/pivot","source_language":"zh-CN","owned_paths":["catalog/Archaeology/WindowsPhoneMetro/Pivot"],"depends_on":["controls.pivot-view"],"provides":[],"archaeology_refs":[],"historical_label":"Windows Phone Pivot","public_api_name":"PivotView","license_review":"pending"}
