{"schema_version":1,"id":"archaeology.windows8.charms-bar","display_name":"Charms Bar","kind":"archaeology","status":"proposed","maturity":"lab","priority":"P2","package":"WinUI3.Senior.Archaeology","namespace":"WinUI3.Senior.Archaeology.Windows8","gallery_route":"/archaeology/windows-8/charms-bar","source_language":"zh-CN","owned_paths":["catalog/Archaeology/Windows8/CharmsBar/**"],"depends_on":["windowing.edge-command-panel"],"provides":["exhibit.windows8.charms-bar"],"archaeology_refs":["windowing.edge-command-panel"],"historical_label":"Windows 8 Charms bar","public_api_name":"EdgeCommandPanel","license_review":"pending"}
