{"schema_version":1,"id":"archaeology.windows11.focus-sessions","display_name":"Focus Sessions","kind":"archaeology","status":"proposed","maturity":"lab","priority":"P2","package":"WinUI3.Senior.Archaeology","namespace":"WinUI3.Senior.Archaeology.Windows11","gallery_route":"/archaeology/windows-11/focus-sessions","source_language":"zh-CN","owned_paths":["catalog/Archaeology/Windows11/FocusSessions/**"],"depends_on":["experiences.focus-session"],"provides":["exhibit.windows11.focus-sessions"],"archaeology_refs":["experiences.focus-session"],"historical_label":"Windows 11 Focus sessions","public_api_name":"FocusSession","license_review":"pending"}
