{"schema_version":1,"id":"archaeology.windows-phone-metro.live-tile","display_name":"Live Tile","kind":"archaeology","status":"proposed","maturity":"lab","priority":"P1","package":"WinUI3.Senior.Archaeology","namespace":"WinUI3.Senior.Archaeology","gallery_route":"/archaeology/windows-phone-metro/live-tile","source_language":"zh-CN","owned_paths":["catalog/Archaeology/WindowsPhoneMetro/LiveTile"],"depends_on":["controls.dynamic-tile"],"provides":[],"archaeology_refs":[],"historical_label":"Live Tile","public_api_name":"DynamicTile","license_review":"pending"}
