{"schema_version":1,"id":"archaeology.windows10.action-center","display_name":"Action Center","kind":"archaeology","status":"proposed","maturity":"lab","priority":"P2","package":"WinUI3.Senior.Archaeology","namespace":"WinUI3.Senior.Archaeology.Windows10","gallery_route":"/archaeology/windows-10/action-center","source_language":"zh-CN","owned_paths":["catalog/Archaeology/Windows10/ActionCenter/**"],"depends_on":["controls.snackbar-host"],"provides":["exhibit.windows10.action-center"],"archaeology_refs":["controls.snackbar-host"],"historical_label":"Windows 10 Action Center","public_api_name":null,"license_review":"pending"}
