{"schema_version":1,"id":"archaeology.windows10.timeline","display_name":"Timeline","kind":"archaeology","status":"proposed","maturity":"lab","priority":"P2","package":"WinUI3.Senior.Archaeology","namespace":"WinUI3.Senior.Archaeology.Windows10","gallery_route":"/archaeology/windows-10/timeline","source_language":"zh-CN","owned_paths":["catalog/Archaeology/Windows10/Timeline/**"],"depends_on":[],"provides":["exhibit.windows10.timeline"],"archaeology_refs":[],"historical_label":"Windows 10 Timeline","public_api_name":null,"license_review":"pending"}
