{"schema_version":1,"id":"archaeology.media-software-history.cover-flow","display_name":"Cover Flow","kind":"archaeology","status":"proposed","maturity":"lab","priority":"P1","package":"WinUI3.Senior.Archaeology","namespace":"WinUI3.Senior.Archaeology","gallery_route":"/archaeology/media-software-history/cover-flow","source_language":"zh-CN","owned_paths":["catalog/Archaeology/MediaSoftwareHistory/CoverFlow"],"depends_on":["controls.carousel-view"],"provides":[],"archaeology_refs":[],"historical_label":"Cover Flow in iTunes 7","public_api_name":"CarouselView","license_review":"pending"}
