{"schema_version":1,"id":"archaeology.windows10.sets","display_name":"Sets","kind":"archaeology","status":"proposed","maturity":"lab","priority":"P2","package":"WinUI3.Senior.Archaeology","namespace":"WinUI3.Senior.Archaeology.Windows10","gallery_route":"/archaeology/windows-10/sets","source_language":"zh-CN","owned_paths":["catalog/Archaeology/Windows10/Sets/**"],"depends_on":["experiences.tabbed-shell"],"provides":["exhibit.windows10.sets"],"archaeology_refs":["experiences.tabbed-shell"],"historical_label":"Windows 10 Sets","public_api_name":"TabbedShell","license_review":"pending"}
