{
    "schema_version":  1,
    "id":  "future.captions-abstractions",
    "display_name":  "Captions.Abstractions",
    "kind":  "service",
    "status":  "proposed",
    "maturity":  "lab",
    "priority":  "P3",
    "package":  "WinUI3.Senior.Core",
    "namespace":  "WinUI3.Senior.Core",
    "gallery_route":  "",
    "source_language":  "zh-CN",
    "owned_paths":  [
                        "catalog/Experiences/Future/CaptionsAbstractions"
                    ],
    "depends_on":  [
                       "contracts.timed-text"
                   ],
    "provides":  [
                     "service:future.captions-abstractions"
                 ],
    "archaeology_refs":  [

                         ],
    "license_review":  "not-required"
}
