{"schema_version":1,"id":"archaeology.windows-media-center.overlay-menu","display_name":"Media Center Overlay Menu","kind":"archaeology","status":"proposed","maturity":"lab","priority":"P1","package":"WinUI3.Senior.Archaeology","namespace":"WinUI3.Senior.Archaeology","gallery_route":"/archaeology/windows-media-center/overlay-menu","source_language":"zh-CN","owned_paths":["catalog/Archaeology/WindowsMediaCenter/OverlayMenu"],"depends_on":["controls.overlay-menu"],"provides":[],"archaeology_refs":[],"historical_label":"Windows Media Center Overlay Menu","public_api_name":"OverlayMenu","license_review":"pending"}
