{
    "schema_version":  1,
    "id":  "windowing.settings-panel",
    "display_name":  "SettingsPanel",
    "kind":  "control",
    "status":  "in-progress",
    "maturity":  "lab",
    "priority":  "P2",
    "package":  "WinUI3.Senior.Windowing",
    "namespace":  "WinUI3.Senior.Windowing",
    "gallery_route":  "/windowing/settings-panel",
    "source_language":  "zh-CN",
    "owned_paths":  [
                        "catalog/Windowing/SettingsPanel",
                        "src/WinUI3.Senior.Windowing/SettingsPanel.cs"
                    ],
    "depends_on":  [
                       "contracts.windowing"
                   ],
    "provides":  [
                     "control:windowing.settings-panel"
                 ],
    "archaeology_refs":  [

                         ],
    "license_review":  "not-required"
}
